{
  "id": "thruster_nozzle",
  "display_name_key": "SALVAGE_THRUSTER_NOZZLE",
  "sprite": "res://assets/original/salvage/thruster_nozzle_hd.webp",
  "category": "propulsion",
  "rarity": "uncommon",
  "base_value": 70,
  "mass": 2.4,
  "collect_duration": 1.65,
  "cleanliness_value": 2.7,
  "cargo_units": 3,
  "visual_scale": 0.62,
  "collision_radius": 29,
  "visual_profile": {
    "motion": "spin",
    "effect": "spark",
    "spin_multiplier": 0.85,
    "float_amplitude": 2
  },
  "tags": [
    "propulsion",
    "metal",
    "mars"
  ]
}
