{
  "id": "cargo_canister",
  "display_name_key": "SALVAGE_CARGO_CANISTER",
  "sprite": "res://assets/original/salvage/cargo_canister_hd.webp",
  "category": "cargo",
  "rarity": "common",
  "base_value": 34,
  "mass": 1.6,
  "collect_duration": 1.1,
  "cleanliness_value": 1.8,
  "cargo_units": 2,
  "visual_scale": 0.0825,
  "collision_radius": 26,
  "visual_profile": {
    "motion": "heavy",
    "effect": "none",
    "spin_multiplier": 0.18,
    "float_amplitude": 1.4
  },
  "tags": [
    "cargo",
    "container",
    "mars"
  ]
}
