{
  "id": "survey_beacon",
  "display_name_key": "SALVAGE_SURVEY_BEACON",
  "sprite": "res://assets/original/salvage/survey_beacon_hd.webp",
  "category": "research",
  "rarity": "rare",
  "base_value": 135,
  "mass": 1.7,
  "collect_duration": 1.6,
  "cleanliness_value": 3,
  "cargo_units": 2,
  "visual_scale": 0.72,
  "collision_radius": 27,
  "visual_profile": {
    "motion": "stable",
    "effect": "orbit",
    "spin_multiplier": 0.08,
    "float_amplitude": 2.8
  },
  "tags": [
    "research",
    "beacon",
    "nebula"
  ]
}
