{
  "id": "scrap_fragment",
  "display_name_key": "SALVAGE_SCRAP_FRAGMENT",
  "sprite": "res://assets/original/salvage/scrap_fragment_hd.webp",
  "category": "scrap",
  "rarity": "common",
  "base_value": 12,
  "mass": 0.65,
  "collect_duration": 0.55,
  "cleanliness_value": 1,
  "cargo_units": 1,
  "visual_scale": 0.1024,
  "collision_radius": 20,
  "visual_profile": {
    "motion": "tumble",
    "effect": "none",
    "spin_multiplier": 0.82,
    "float_amplitude": 3.6
  },
  "tags": [
    "metal",
    "training"
  ]
}
