{
  "id": "mining_coupler",
  "display_name_key": "SALVAGE_MINING_COUPLER",
  "sprite": "res://assets/original/salvage/mining_coupler_hd.webp",
  "category": "mining",
  "rarity": "common",
  "base_value": 28,
  "mass": 1.15,
  "collect_duration": 0.9,
  "cleanliness_value": 1.6,
  "cargo_units": 1,
  "visual_scale": 0.1308,
  "collision_radius": 21,
  "visual_profile": {
    "motion": "tumble",
    "effect": "spark",
    "spin_multiplier": 0.48,
    "float_amplitude": 2.1
  },
  "tags": [
    "lunar",
    "mining",
    "industrial"
  ]
}
