{
  "id": "explorer_core",
  "display_name_key": "SALVAGE_EXPLORER_CORE",
  "sprite": "res://assets/original/salvage/explorer_core_hd.webp",
  "category": "research",
  "rarity": "epic",
  "base_value": 260,
  "mass": 3.8,
  "collect_duration": 2.8,
  "cleanliness_value": 4.8,
  "cargo_units": 5,
  "visual_scale": 0.0654,
  "collision_radius": 38,
  "visual_profile": {
    "motion": "drift",
    "effect": "orbit",
    "spin_multiplier": 0.12,
    "float_amplitude": 3
  },
  "tags": [
    "explorer",
    "core",
    "rare",
    "nebula"
  ]
}
