{
  "id": "telemetry_unit",
  "display_name_key": "SALVAGE_TELEMETRY_UNIT",
  "sprite": "res://assets/original/salvage/telemetry_unit_hd.webp",
  "category": "electronics",
  "rarity": "uncommon",
  "base_value": 58,
  "mass": 1.35,
  "collect_duration": 1.2,
  "cleanliness_value": 2,
  "cargo_units": 2,
  "visual_scale": 0.58,
  "collision_radius": 23,
  "visual_profile": {
    "motion": "drift",
    "effect": "scan",
    "spin_multiplier": 0.16,
    "float_amplitude": 2.7
  },
  "tags": [
    "telemetry",
    "electronics",
    "earth"
  ]
}
