{
  "id": "pressure_valve",
  "display_name_key": "SALVAGE_PRESSURE_VALVE",
  "sprite": "res://assets/original/salvage/pressure_valve_hd.webp",
  "category": "industrial",
  "rarity": "common",
  "base_value": 26,
  "mass": 1,
  "collect_duration": 0.82,
  "cleanliness_value": 1.35,
  "cargo_units": 1,
  "visual_scale": 0.1166,
  "collision_radius": 19,
  "visual_profile": {
    "motion": "tumble",
    "effect": "spark",
    "spin_multiplier": 0.36,
    "float_amplitude": 1.6
  },
  "tags": [
    "mars",
    "industrial",
    "service"
  ]
}
