{
  "id": "reactor_shielding",
  "display_name_key": "SALVAGE_REACTOR_SHIELDING",
  "sprite": "res://assets/original/salvage/reactor_shielding_hd.webp",
  "category": "power",
  "rarity": "uncommon",
  "base_value": 78,
  "mass": 3.3,
  "collect_duration": 2.15,
  "cleanliness_value": 3.5,
  "cargo_units": 4,
  "visual_scale": 0.52,
  "collision_radius": 36,
  "visual_profile": {
    "motion": "heavy",
    "effect": "pulse",
    "spin_multiplier": 0.08,
    "float_amplitude": 1.2
  },
  "tags": [
    "reactor",
    "dense",
    "mars"
  ]
}
