{
  "id": "station_bracket",
  "display_name_key": "SALVAGE_STATION_BRACKET",
  "sprite": "res://assets/original/salvage/station_bracket_hd.webp",
  "category": "scrap",
  "rarity": "common",
  "base_value": 20,
  "mass": 0.85,
  "collect_duration": 0.7,
  "cleanliness_value": 1.2,
  "cargo_units": 1,
  "visual_scale": 0.88,
  "collision_radius": 20,
  "visual_profile": {
    "motion": "tumble",
    "effect": "none",
    "spin_multiplier": 0.44,
    "float_amplitude": 2.2
  },
  "tags": [
    "station",
    "metal",
    "earth"
  ]
}
