{
  "id": "satellite_panel",
  "display_name_key": "SALVAGE_SATELLITE_PANEL",
  "sprite": "res://assets/original/salvage/satellite_panel_hd.webp",
  "category": "electronics",
  "rarity": "uncommon",
  "base_value": 44,
  "mass": 1.7,
  "collect_duration": 1.35,
  "cleanliness_value": 2.2,
  "cargo_units": 2,
  "visual_scale": 0.72,
  "collision_radius": 28,
  "visual_profile": {
    "motion": "drift",
    "effect": "scan",
    "spin_multiplier": 0.14,
    "float_amplitude": 2.4
  },
  "tags": [
    "satellite",
    "panel",
    "training"
  ]
}
