{
  "id": "mars_freight_crate",
  "display_name_key": "SALVAGE_MARS_FREIGHT_CRATE",
  "sprite": "res://assets/original/salvage/mars_freight_crate_hd.webp",
  "category": "cargo",
  "rarity": "uncommon",
  "base_value": 68,
  "mass": 2.3,
  "collect_duration": 1.5,
  "cleanliness_value": 2.5,
  "cargo_units": 3,
  "visual_scale": 0.66,
  "collision_radius": 30,
  "visual_profile": {
    "motion": "heavy",
    "effect": "none",
    "spin_multiplier": 0.12,
    "float_amplitude": 1
  },
  "tags": [
    "mars",
    "cargo",
    "freight"
  ]
}
