{
  "id": "service_scrap",
  "display_name_key": "SALVAGE_SERVICE_SCRAP",
  "sprite": "res://assets/original/salvage/service_scrap_hd.webp",
  "category": "scrap",
  "rarity": "common",
  "base_value": 18,
  "mass": 0.9,
  "collect_duration": 0.75,
  "cleanliness_value": 1.2,
  "cargo_units": 1,
  "visual_scale": 0.1564,
  "collision_radius": 22,
  "visual_profile": {
    "motion": "tumble",
    "effect": "none",
    "spin_multiplier": 0.62,
    "float_amplitude": 3
  },
  "tags": [
    "service",
    "training"
  ]
}
