{
  "id": "antenna_array",
  "display_name_key": "SALVAGE_ANTENNA_ARRAY",
  "sprite": "res://assets/original/salvage/antenna_array_hd.webp",
  "category": "electronics",
  "rarity": "uncommon",
  "base_value": 52,
  "mass": 1.5,
  "collect_duration": 1.2,
  "cleanliness_value": 2.1,
  "cargo_units": 2,
  "visual_scale": 0.1138,
  "collision_radius": 30,
  "visual_profile": {
    "motion": "stable",
    "effect": "scan",
    "spin_multiplier": 0.18,
    "float_amplitude": 2.2
  },
  "tags": [
    "communications",
    "satellite",
    "earth"
  ]
}
