{
  "id": "solar_cell_bundle",
  "display_name_key": "SALVAGE_SOLAR_CELL_BUNDLE",
  "sprite": "res://assets/original/salvage/solar_cell_bundle_hd.webp",
  "category": "power",
  "rarity": "uncommon",
  "base_value": 64,
  "mass": 1.4,
  "collect_duration": 1.25,
  "cleanliness_value": 2.2,
  "cargo_units": 2,
  "visual_scale": 0.66,
  "collision_radius": 25,
  "visual_profile": {
    "motion": "drift",
    "effect": "pulse",
    "spin_multiplier": 0.12,
    "float_amplitude": 2.4
  },
  "tags": [
    "solar",
    "power",
    "earth"
  ]
}
