{
  "id": "quantum_relay",
  "display_name_key": "SALVAGE_QUANTUM_RELAY",
  "sprite": "res://assets/original/salvage/quantum_relay_hd.webp",
  "category": "electronics",
  "rarity": "epic",
  "base_value": 240,
  "mass": 3.1,
  "collect_duration": 2.5,
  "cleanliness_value": 4.4,
  "cargo_units": 4,
  "visual_scale": 0.55,
  "collision_radius": 34,
  "visual_profile": {
    "motion": "stable",
    "effect": "orbit",
    "spin_multiplier": 0.08,
    "float_amplitude": 3.2
  },
  "tags": [
    "relay",
    "electronics",
    "rare",
    "nebula"
  ]
}
