{
  "id": "thermal_tile",
  "display_name_key": "SALVAGE_THERMAL_TILE",
  "sprite": "res://assets/original/salvage/thermal_tile_hd.webp",
  "category": "scrap",
  "rarity": "common",
  "base_value": 22,
  "mass": 0.7,
  "collect_duration": 0.6,
  "cleanliness_value": 1.1,
  "cargo_units": 1,
  "visual_scale": 0.1308,
  "collision_radius": 18,
  "visual_profile": {
    "motion": "tumble",
    "effect": "none",
    "spin_multiplier": 0.51,
    "float_amplitude": 2.3
  },
  "tags": [
    "thermal",
    "ceramic",
    "lunar"
  ]
}
