{
  "id": "orbital_battery",
  "display_name_key": "SALVAGE_ORBITAL_BATTERY",
  "sprite": "res://assets/original/salvage/orbital_battery_hd.webp",
  "category": "power",
  "rarity": "rare",
  "base_value": 148,
  "mass": 2.6,
  "collect_duration": 1.95,
  "cleanliness_value": 3.2,
  "cargo_units": 3,
  "visual_scale": 0.7,
  "collision_radius": 28,
  "visual_profile": {
    "motion": "pulse",
    "effect": "pulse",
    "spin_multiplier": 0.06,
    "float_amplitude": 2.2
  },
  "tags": [
    "power",
    "battery",
    "mars"
  ]
}
