{
  "id": "sensor_pod",
  "display_name_key": "SALVAGE_SENSOR_POD",
  "sprite": "res://assets/original/salvage/sensor_pod_hd.webp",
  "category": "electronics",
  "rarity": "common",
  "base_value": 32,
  "mass": 1.35,
  "collect_duration": 1.05,
  "cleanliness_value": 1.8,
  "cargo_units": 2,
  "visual_scale": 0.1081,
  "collision_radius": 24,
  "visual_profile": {
    "motion": "stable",
    "effect": "scan",
    "spin_multiplier": 0.18,
    "float_amplitude": 2.4
  },
  "tags": [
    "electronics",
    "satellite",
    "training"
  ]
}
