{
  "id": "coolant_cell",
  "display_name_key": "SALVAGE_COOLANT_CELL",
  "sprite": "res://assets/original/salvage/coolant_cell_hd.webp",
  "category": "cargo",
  "rarity": "common",
  "base_value": 30,
  "mass": 1.2,
  "collect_duration": 0.95,
  "cleanliness_value": 1.5,
  "cargo_units": 1,
  "visual_scale": 0.0711,
  "collision_radius": 20,
  "visual_profile": {
    "motion": "drift",
    "effect": "pulse",
    "spin_multiplier": 0.22,
    "float_amplitude": 2
  },
  "tags": [
    "service",
    "cargo",
    "earth"
  ]
}
