{
  "id": "navigation_core",
  "display_name_key": "SALVAGE_NAVIGATION_CORE",
  "sprite": "res://assets/original/salvage/navigation_core_hd.webp",
  "category": "electronics",
  "rarity": "rare",
  "base_value": 120,
  "mass": 2,
  "collect_duration": 1.8,
  "cleanliness_value": 2.8,
  "cargo_units": 3,
  "visual_scale": 0.62,
  "collision_radius": 26,
  "visual_profile": {
    "motion": "stable",
    "effect": "scan",
    "spin_multiplier": 0.1,
    "float_amplitude": 2.6
  },
  "tags": [
    "electronics",
    "navigation",
    "earth"
  ]
}
