{
  "id": "lunar_regolith_canister",
  "display_name_key": "SALVAGE_LUNAR_REGOLITH_CANISTER",
  "sprite": "res://assets/original/salvage/lunar_regolith_canister_hd.webp",
  "category": "mining",
  "rarity": "uncommon",
  "base_value": 62,
  "mass": 2.2,
  "collect_duration": 1.45,
  "cleanliness_value": 2.4,
  "cargo_units": 3,
  "visual_scale": 0.0768,
  "collision_radius": 27,
  "visual_profile": {
    "motion": "heavy",
    "effect": "pulse",
    "spin_multiplier": 0.22,
    "float_amplitude": 1.5
  },
  "tags": [
    "lunar",
    "mining",
    "sample"
  ]
}
